{
  "id": "village_well_square",
  "category": "site",
  "site_types": ["village"],
  "size": [5, 3, 5],
  "origin": [2, 0, 2],
  "blocks": [
    { "x": 0, "y": 0, "z": 0, "id": 30 },
    { "x": 1, "y": 0, "z": 0, "id": 30 },
    { "x": 2, "y": 0, "z": 0, "id": 30 },
    { "x": 3, "y": 0, "z": 0, "id": 30 },
    { "x": 4, "y": 0, "z": 0, "id": 30 },

    { "x": 0, "y": 0, "z": 1, "id": 30 },
    { "x": 1, "y": 0, "z": 1, "id": 0 },
    { "x": 2, "y": 0, "z": 1, "id": 0 },
    { "x": 3, "y": 0, "z": 1, "id": 0 },
    { "x": 4, "y": 0, "z": 1, "id": 30 },

    { "x": 0, "y": 0, "z": 2, "id": 30 },
    { "x": 1, "y": 0, "z": 2, "id": 0 },
    { "x": 2, "y": 0, "z": 2, "id": 6 },
    { "x": 3, "y": 0, "z": 2, "id": 0 },
    { "x": 4, "y": 0, "z": 2, "id": 30 },

    { "x": 0, "y": 0, "z": 3, "id": 30 },
    { "x": 1, "y": 0, "z": 3, "id": 0 },
    { "x": 2, "y": 0, "z": 3, "id": 0 },
    { "x": 3, "y": 0, "z": 3, "id": 0 },
    { "x": 4, "y": 0, "z": 3, "id": 30 },

    { "x": 0, "y": 0, "z": 4, "id": 30 },
    { "x": 1, "y": 0, "z": 4, "id": 30 },
    { "x": 2, "y": 0, "z": 4, "id": 30 },
    { "x": 3, "y": 0, "z": 4, "id": 30 },
    { "x": 4, "y": 0, "z": 4, "id": 30 },

    { "x": 0, "y": 1, "z": 0, "id": 30 },
    { "x": 4, "y": 1, "z": 0, "id": 30 },
    { "x": 0, "y": 1, "z": 4, "id": 30 },
    { "x": 4, "y": 1, "z": 4, "id": 30 }
  ],
  "tags": ["starter", "town_center"]
}
