{
  "id": "village_house_small",
  "category": "building",
  "site_types": ["village", "hamlet"],
  "size": [5, 4, 5],
  "origin": [2, 0, 2],
  "blocks": [
    { "x": 0, "y": 0, "z": 0, "id": 30 },
    { "x": 1, "y": 0, "z": 0, "id": 30 },
    { "x": 2, "y": 0, "z": 0, "id": 30 },
    { "x": 3, "y": 0, "z": 0, "id": 30 },
    { "x": 4, "y": 0, "z": 0, "id": 30 },

    { "x": 0, "y": 0, "z": 1, "id": 30 },
    { "x": 4, "y": 0, "z": 1, "id": 30 },
    { "x": 0, "y": 0, "z": 2, "id": 30 },
    { "x": 4, "y": 0, "z": 2, "id": 30 },
    { "x": 0, "y": 0, "z": 3, "id": 30 },
    { "x": 4, "y": 0, "z": 3, "id": 30 },

    { "x": 0, "y": 0, "z": 4, "id": 30 },
    { "x": 1, "y": 0, "z": 4, "id": 30 },
    { "x": 2, "y": 0, "z": 4, "id": 30 },
    { "x": 3, "y": 0, "z": 4, "id": 30 },
    { "x": 4, "y": 0, "z": 4, "id": 30 },

    { "x": 0, "y": 1, "z": 0, "id": 4 },
    { "x": 1, "y": 1, "z": 0, "id": 4 },
    { "x": 2, "y": 1, "z": 0, "id": 4 },
    { "x": 3, "y": 1, "z": 0, "id": 4 },
    { "x": 4, "y": 1, "z": 0, "id": 4 },

    { "x": 0, "y": 1, "z": 1, "id": 4 },
    { "x": 4, "y": 1, "z": 1, "id": 4 },
    { "x": 0, "y": 1, "z": 2, "id": 4 },
    { "x": 2, "y": 1, "z": 2, "id": 0 },
    { "x": 4, "y": 1, "z": 2, "id": 4 },
    { "x": 0, "y": 1, "z": 3, "id": 4 },
    { "x": 4, "y": 1, "z": 3, "id": 4 },

    { "x": 0, "y": 1, "z": 4, "id": 4 },
    { "x": 1, "y": 1, "z": 4, "id": 4 },
    { "x": 3, "y": 1, "z": 4, "id": 4 },
    { "x": 4, "y": 1, "z": 4, "id": 4 },

    { "x": 1, "y": 2, "z": 1, "id": 21 },
    { "x": 2, "y": 2, "z": 1, "id": 21 },
    { "x": 3, "y": 2, "z": 1, "id": 21 },
    { "x": 1, "y": 2, "z": 2, "id": 21 },
    { "x": 2, "y": 2, "z": 2, "id": 21 },
    { "x": 3, "y": 2, "z": 2, "id": 21 },
    { "x": 1, "y": 2, "z": 3, "id": 21 },
    { "x": 2, "y": 2, "z": 3, "id": 21 },
    { "x": 3, "y": 2, "z": 3, "id": 21 }
  ],
  "tags": ["residential"]
}
